{
    "$schema": "https://json-schema.org/draft/2020-12/schema",
    "$id": "https://dfc/schemas/civilian/civilian_ship.json",
    "title": "DFC Civilian Ship Data",
    "description": "Data file for a civilian ship class. Identical to the fleet ship format except points may be null for scenario-only ships.",
    "type": "object",
    "required": [
        "Class",
        "Type",
        "Points",
        "Tonnage",
        "BaseSize",
        "Profile",
        "Weapons",
        "Load",
        "KnownShips",
        "Flavour"
    ],
    "additionalProperties": false,
    "properties": {
        "Class":             { "type": "string" },
        "Type":              { "type": "string" },
        "Points":            { "type": ["integer", "null"] },
        "Tonnage":           { "$ref": "https://dfc/schemas/defs.json#/$defs/Tonnage" },
        "BaseSize":          { "type": "integer" },
        "Profile":           { "$ref": "https://dfc/schemas/defs.json#/$defs/ShipProfile" },
        "Weapons":           { "type": "array", "items": { "$ref": "https://dfc/schemas/defs.json#/$defs/Weapon" } },
        "Load":              { "type": "array", "items": { "$ref": "https://dfc/schemas/defs.json#/$defs/LoadEntry" } },
        "Upgrades":          { "type": "array", "items": { "$ref": "https://dfc/schemas/defs.json#/$defs/UpgradeEntry" } },
        "Rules":             { "type": "array", "items": { "$ref": "https://dfc/schemas/defs.json#/$defs/Rule" } },
        "AdmiralAbilities":  { "type": "array", "items": { "$ref": "https://dfc/schemas/defs.json#/$defs/Ability" } },
        "UsableIn":          { "type": "array", "items": { "$ref": "https://dfc/schemas/defs.json#/$defs/UsableInEntry" } },
        "KnownShips":        { "type": "array", "items": { "type": "string" } },
        "Flavour":           { "type": "string" }
    }
}
