{
    "Class": "Spinel",
    "Type": "Pocket Battleship",
    "Points": 225,
    "Tonnage": "H",
    "BaseSize": 50,
    "Profile": {
        "Thrust": 8,
        "Scan": 12,
        "Sig": 6,
        "Hull": 14,
        "ES": "5+",
        "KS": "4+",
        "BS": "5+",
        "G": "1",
        "Special": [
            "Shield-4+"
        ]
    },
    "Weapons": [
        {
            "Name": "Particle Lance Pair",
            "Arc": "FN",
            "Att": 2,
            "Lock": "3+",
            "DMG": 2,
            "Type": "C",
            "Special": [
                "Critical-1"
            ]
        },
        {
            "Name": "Twin Hyperwave Cannon",
            "Arc": "F",
            "Att": 4,
            "Lock": "3+",
            "DMG": 2,
            "Type": "E",
            "Special": [
                "Crippling-2xFire"
            ]
        }
    ],
    "Load": [],
    "Rules": [
        {
            "Name": "Feature Carrier",
            "Text": "At the start of the game, before players deploy, choose two Deployable Features from the Shaltari Deployable Features List (duplicates are allowed). This Ship starts the game carrying those Deployable Features."
        }
    ],
    "KnownShips": [
        "Lance of Ra",
        "Eons to Dust",
        "Reducer",
        "Star Hunter"
    ],
    "Flavour": "The other side to the alien's increasing battlecruiser production was the introduction in numbers of pocket battleships in late 2678. Based on the proven battlecruiser superstructure, these already dreaded ships bring the full firepower of regular battlecruisers plus additional durability and capability in exchange for raw speed.\nThese ships differ substantially from battleships though, being lighter but also often offering the ability to carry and launch self-deploying surface instillations. Although supercruisers present a more economical option to bring these to the battlefront, pocket battleships also offer the full firepower befitting their vast size. The Spinel, one of the more 'common' variants, packs the previously unknown combination of a twin Hyperwave Cannon and a pair of Particle Lances. Both systems provide the Starchief with superlative, front-facing killing power."
}