{
    "Class": "Bruges",
    "Type": "Cruiser",
    "Points": 84,
    "Tonnage": "M",
    "BaseSize": 40,
    "Profile": {
        "Thrust": 8,
        "Scan": 6,
        "Sig": 6,
        "Hull": 10,
        "ES": "4+",
        "KS": "3+",
        "BS": "-",
        "G": "1-2",
        "Special": []
    },
    "Weapons": [
        {
            "Name": "Cobra Heavy Laser",
            "Arc": "FN",
            "Att": 4,
            "Lock": "3+",
            "DMG": 1,
            "Type": "E",
            "Special": [
                "Burnthrough-1",
                "Flash-1",
                "Focused"
            ]
        },
        {
            "Name": "Taipan Laser Turrets",
            "Arc": "F/S",
            "Att": 2,
            "Lock": "2+",
            "DMG": 1,
            "Type": "E",
            "Special": [
                "Scald-2"
            ]
        }
    ],
    "Load": [],
    "KnownShips": [],
    "Flavour": ""
}