{
    "Class": "Carronade",
    "Type": "Heavy Cruiser",
    "Points": 120,
    "Tonnage": "M",
    "BaseSize": 40,
    "Profile": {
        "Thrust": 7,
        "Scan": 11,
        "Sig": 4,
        "Hull": 9,
        "ES": "4+",
        "KS": "4+",
        "BS": "5+",
        "G": "1",
        "Special": [
            "Porter S-1"
        ]
    },
    "Weapons": [
        {
            "Name": "Barb Launcher",
            "Arc": "FN",
            "Att": 1,
            "Lock": "2+",
            "DMG": 4,
            "Type": "K",
            "Special": [
                "Reave-2"
            ]
        },
        {
            "Name": "Barb Launcher",
            "Arc": "FN",
            "Att": 1,
            "Lock": "2+",
            "DMG": 4,
            "Type": "K",
            "Special": [
                "Reave-2"
            ]
        }
    ],
    "Load": [],
    "KnownShips": [],
    "Flavour": ""
}