{
    "Class": "Diode",
    "Type": "Destroyer",
    "Points": 75,
    "Tonnage": "L",
    "BaseSize": 30,
    "Profile": {
        "Thrust": 8,
        "Scan": 8,
        "Sig": 2,
        "Hull": 5,
        "ES": "4+",
        "KS": "4+",
        "BS": "5+",
        "G": "1-3",
        "Special": []
    },
    "Weapons": [
        {
            "Name": "Bisector",
            "Arc": "FN",
            "Att": 2,
            "Lock": "3+",
            "DMG": 3,
            "Type": "E",
            "Special": [
                "Bloom-1",
                "Calibre-H/C",
                "Focused",
                "Penetrator"
            ]
        }
    ],
    "Load": [],
    "KnownShips": [],
    "Flavour": ""
}