{
    "Class": "Construct",
    "Type": "Cruiser",
    "Points": 96,
    "Tonnage": "M",
    "BaseSize": 40,
    "Profile": {
        "Thrust": 8,
        "Scan": 10,
        "Sig": 3,
        "Hull": 7,
        "ES": "4+",
        "KS": "4+",
        "BS": "-",
        "G": "1-2",
        "Special": [
            "Porter S-1"
        ]
    },
    "Weapons": [
        {
            "Name": "Scythes",
            "Arc": "FN",
            "Att": 8,
            "Lock": "4+",
            "DMG": 1,
            "Type": "E",
            "Special": [
                "Anti Wing",
                "Fusillade-3",
                "Reave-1"
            ]
        },
        {
            "Name": "Barb Stinger",
            "Arc": "FN",
            "Att": 1,
            "Lock": "2+",
            "DMG": 2,
            "Type": "K",
            "Special": [
                "Reave-1"
            ]
        }
    ],
    "Load": [],
    "KnownShips": [],
    "Flavour": ""
}